{
  "schema_version": 1,
  "phase": "7T",
  "action": "anchor_manifest",
  "timestamp_utc": "20250915T211705Z",
  "host": {"kernel":"5.15.167.4-microsoft-standard-WSL2","machine":"x86_64","system":"Linux"},
  "provenance": {
    "algorithm": "sha256",
    "canonicalization": "utf8+lf+trim-trailing",
    "manifest_path": "var/reports/phase7t/manifest_docs_phase7s.json",
    "manifest_sha256": "abe5412bf583a9b843a336b9b46c6d8c929e11f87f09be187547353ca1c5ef0e"
  },
  "links": [
    {"rel": "manifest", "path": "var/reports/phase7t/manifest_docs_phase7s.json"},
    {"rel": "self-verify", "cmd": "bash scripts/phase7t/verify_provenance.sh var/reports/phase7t/manifest_docs_phase7s.json"}
  ],
  "status": "ok",
  "details": {"entries": 9}
}
