{
  "action": "cas_local_store",
  "details": {
    "bytes_total": 9377,
    "dedup_hits": 9,
    "objects_total": 9,
    "stored_bytes": 0,
    "stored_new": 0,
    "touched": [
      {
        "cas_obj": ".cas/sha256/13f596200e74ac01605f18107d77c067d6af255b9fa910483570edd22a924fef",
        "digest": "13f596200e74ac01605f18107d77c067d6af255b9fa910483570edd22a924fef",
        "kind": "text",
        "path": "docs/phase7s/COLLAB_INVITE.md",
        "size": 897
      },
      {
        "cas_obj": ".cas/sha256/4ec73735b6c82b6f0881cbc226262dac85f976f28f3fb96917c135e67b94bf38",
        "digest": "4ec73735b6c82b6f0881cbc226262dac85f976f28f3fb96917c135e67b94bf38",
        "kind": "text",
        "path": "docs/phase7s/COLLAB_INVITE_EMAIL.txt",
        "size": 499
      },
      {
        "cas_obj": ".cas/sha256/3ea5ed62939fdacb292995e316b9a70c7cbc18d15f9adb4cf543a1d914bba95b",
        "digest": "3ea5ed62939fdacb292995e316b9a70c7cbc18d15f9adb4cf543a1d914bba95b",
        "kind": "text",
        "path": "docs/phase7s/COMMUNITY_VALIDATION.md",
        "size": 578
      },
      {
        "cas_obj": ".cas/sha256/60fa8e54e4e735cd514539936730d4e73095f2959770e9fabed315a7f91a12f9",
        "digest": "60fa8e54e4e735cd514539936730d4e73095f2959770e9fabed315a7f91a12f9",
        "kind": "text",
        "path": "docs/phase7s/FINAL_REPORT.md",
        "size": 871
      },
      {
        "cas_obj": ".cas/sha256/c9bc56b11f03de2a5f706088b178440af95d95e83e08f4409bd8af7821ee4ede",
        "digest": "c9bc56b11f03de2a5f706088b178440af95d95e83e08f4409bd8af7821ee4ede",
        "kind": "text",
        "path": "docs/phase7s/G2_NATIVE_UBUNTU_GATE.md",
        "size": 594
      },
      {
        "cas_obj": ".cas/sha256/bbc43e4601c923b0b56fed56e076022878f48e3e40da2c9a18dd21f17a8d11e0",
        "digest": "bbc43e4601c923b0b56fed56e076022878f48e3e40da2c9a18dd21f17a8d11e0",
        "kind": "text",
        "path": "docs/phase7s/GRANT_SUBMISSION_README.md",
        "size": 1163
      },
      {
        "cas_obj": ".cas/sha256/07941bf9ef5c15376f822ec9c9b51ded4f96e728d154ef3e5b9cd7f8c44334d6",
        "digest": "07941bf9ef5c15376f822ec9c9b51ded4f96e728d154ef3e5b9cd7f8c44334d6",
        "kind": "text",
        "path": "docs/phase7s/INDEX.md",
        "size": 2082
      },
      {
        "cas_obj": ".cas/sha256/8e13c99db774eb4cb1ead3f6de5c59ccce7d984cac566f423ec4f044c7e7564c",
        "digest": "8e13c99db774eb4cb1ead3f6de5c59ccce7d984cac566f423ec4f044c7e7564c",
        "kind": "text",
        "path": "docs/phase7s/RELEASE_NOTES_7S.md",
        "size": 1949
      },
      {
        "cas_obj": ".cas/sha256/0648aa2645aa0b909782317ac3501583a295b7d2c5cf2549f6b6f19b087ac265",
        "digest": "0648aa2645aa0b909782317ac3501583a295b7d2c5cf2549f6b6f19b087ac265",
        "kind": "text",
        "path": "docs/phase7s/REVIEW_HANDOFF.md",
        "size": 744
      }
    ]
  },
  "links": [
    {
      "path": "var/reports/phase7t/manifest_20250915T213157Z.json",
      "rel": "manifest"
    },
    {
      "path": ".cas/sha256",
      "rel": "cas_root"
    }
  ],
  "phase": "7T",
  "provenance": {
    "algorithm": "sha256",
    "canonicalization": "utf8+lf+trim-trailing"
  },
  "schema_version": 1,
  "status": "ok",
  "timestamp_utc": "20250915T213157Z"
}